{
  "root_cause_chain": [],
  "critical_decision_points": [
    {
      "step_id": "S0005",
      "decision": "把分析脚本写到 /tmp/fraud_analysis.py 并在该路径执行，而不是保存在任务工作区。",
      "reasoning": "任务原文要求“Save every script you create in this workspace”（T0005，对应 R0007）；S0005 的命令为 cat > /tmp/fraud_analysis.py ... python3 /tmp/fraud_analysis.py（E00018），执行成功并输出计数（E00019）。已读的 S0001–S0006 证据中未见后续把脚本移入工作区的步骤，因此“脚本保存在本工作区”的要求未被满足。该问题不影响已算出的计数或 A. NL 的答案值，属于交付/约束层面的偏差，而非已证实的分析错误。",
      "should_have": "将脚本写入工作区路径（如 ./fraud_analysis.py）并在工作区执行，或在结束前把 /tmp 中的脚本复制到工作区，以满足“脚本保存在本工作区”的明确要求。",
      "evidence_ids": [
        "T0005",
        "E00018",
        "E00019",
        "E00021"
      ]
    }
  ],
  "correct_strategy": "保留已得到的按 ip_country 的欺诈笔数结果与 A. NL 交付；把分析脚本改存到工作区（如 ./fraud_analysis.py）以满足脚本保存要求，并在结束前确认 answer.txt 内容与最终消息一致。若需进一步核验，可在交付说明中明确“top”按欺诈笔数排序；现有任务文本未把排序口径写成欺诈率。",
  "stage_labels": [],
  "summary": "已确认的交付内容：S0005 逐行读取 ./context/payments.csv，按 has_fraudulent_dispute == 'True' 统计 ip_country，得到总记录 138236、欺诈 10765，NL 2955 居首（其后 BE 2493、IT 1652、SE 1627、FR 843、LU 410、ES 407、GR 378，合计 10765）；S0006 将 'A. NL' 写入 ./answer.txt 并 cat 读回，FINAL0001 仅重复 'A. NL'，符合 'X. Y' 格式与“最终消息只重复答案”的要求。readme 将 has_fraudulent_dispute 定义为发卡行欺诈争议指示（E00009），因此以该列计数是可用文档支持的读法。S0004 的 write_stdin 因 Unknown process id 1 失败（E00015），S0005 改用脚本执行后恢复，不构成最终失败原因。唯一有证据的偏差是脚本被写到 /tmp 而非工作区，违反 T0005/R0007，但不改变答案值。未提供参考答案或评分，无法独立确认 A. NL 是否为官方正确答案；任务文本也未明确 'top' 是欺诈笔数还是欺诈率，本诊断不据此断言答案错误。由于没有已证实的分析错误传导到交付答案，root_cause_chain 留空。"
}
