{
  "root_cause_chain": [
    {
      "description": "output1.csv 已生成 562 行，但 recommended_crop 列全部等于 produced_crop（均为 Potatoes），而同一脚本算出的全球推荐作物是 Teff；任务要求该列记录全球推荐作物，因此交付内容与任务定义不符。",
      "step_ids": [
        "S0064"
      ],
      "evidence_ids": [
        "T0005",
        "E00221"
      ]
    },
    {
      "description": "S0063 的最终脚本把最高产作物 Item 选入输出并重命名为 recommended_crop，全球推荐作物变量 recommended_crop（Teff）只用于筛选条件，没有写入输出列；因此 562 行的 recommended_crop 都变成了 produced_crop。",
      "step_ids": [
        "S0063"
      ],
      "evidence_ids": [
        "T0005",
        "E00215",
        "E00221"
      ]
    }
  ],
  "critical_decision_points": [
    {
      "step_id": "S0063",
      "decision": "在最终脚本中把 mismatches 的 Item（最高产作物）选为输出列并重命名为 recommended_crop，而把全球推荐作物 Teff 只用于 Item != recommended_crop 的筛选。",
      "reasoning": "任务要求 output1.csv 的 recommended_crop 记录全球推荐作物；脚本已算出 Teff，但输出列取的是 Item，导致 562 行全部显示 recommended_crop=produced_crop=Potatoes。E00221 的读回确认了该内容。",
      "should_have": "输出列应填入脚本已算出的全球推荐作物 Teff（filtered_cr['label'].value_counts().index[0]），并保留 produced_crop 为最高产作物 Item；重新生成后逐行核对两列是否按任务定义区分。",
      "evidence_ids": [
        "T0005",
        "E00215",
        "E00221"
      ]
    },
    {
      "step_id": "S0064",
      "decision": "运行最终脚本并接受 output1.csv（562 行）和 output2.csv（303 行）的输出，没有在运行后核对 recommended_crop 是否等于全球推荐作物 Teff。",
      "reasoning": "S0064 的返回显示 output1.csv 的 recommended_crop 与 produced_crop 均为 Potatoes，而同一输出开头已打印 Globally recommended crop: Teff；FINAL0001 只说“Now let me verify”，没有实际读回或核对，因此该错误未被发现。",
      "should_have": "运行后读回 output1.csv，核对 recommended_crop 是否等于 Teff、produced_crop 是否为最高产作物，并核对列名/类型/行数；发现不一致时回到脚本修正。",
      "evidence_ids": [
        "T0005",
        "E00220",
        "E00221",
        "FINAL0001"
      ]
    },
    {
      "step_id": "S0050",
      "decision": "在 explore10.py 中同时得到 pesticides.csv Value 的 p75=7869.0 与 yield_df pesticides_tonnes 的 p75=48687.88，随后在最终脚本中采用 pesticides.csv 的 7869.0 作为阈值。",
      "reasoning": "两种口径分别得到 143 条（S0046，yield_df p75=48687.88）与 562 条（S0064，pesticides.csv p75=7869.0）错配，差异显著；任务文本“all pesticide values”没有明确指定数据源，因此该选择是实质性的口径决定，但现有证据不足以判定哪一个是任务要求的。",
      "should_have": "核实任务中“all pesticide values”指哪个数据源（pesticides.csv 的 Value 还是 yield_df 的 pesticides_tonnes），在脚本中记录该口径，并在最终回复中说明；若无法确定，应同时报告两种口径的敏感性。",
      "evidence_ids": [
        "T0005",
        "E00168",
        "E00154",
        "E00215",
        "E00221"
      ]
    },
    {
      "step_id": "S0023",
      "decision": "在推荐数据上访问 cr_c['Area']，但推荐 CSV 没有 Area 列，导致 KeyError: 'Area'；该错误在 S0017–S0031 反复出现，直到 S0032 改为 len(cr_c) 才修正。",
      "reasoning": "S0004 已显示推荐 CSV 的列名不含 Area；S0023/S0025/S0026/S0029 的返回均为 KeyError: 'Area'，S0032 改为样本计数后成功。该错误是已恢复的局部错误，未进入最终脚本，但消耗了大量探索步骤。",
      "should_have": "先检查推荐 CSV 的列名（S0004 已显示没有 Area 列），再决定如何统计推荐样本；推荐数据本身没有国家字段，应改用样本计数或明确说明无法按国家统计。",
      "evidence_ids": [
        "E00070",
        "E00071",
        "E00094",
        "E00105"
      ]
    }
  ],
  "correct_strategy": "修正 output1.csv 的 recommended_crop 列：应填入脚本已算出的全球推荐作物 Teff（filtered_cr['label'].value_counts().index[0]），而不是最高产作物 Item；重新生成后逐行核对 recommended_crop 与 produced_crop 是否按任务定义区分。随后按任务要求读回 output1.csv 和 output2.csv，核对文件名、列名/类型、行数与数值（例如 output1 的 562 行、output2 的 303 行及 is_forecast 布尔值）。对农药阈值来源（pesticides.csv 的 Value 与 yield_df 的 pesticides_tonnes）和 temp_range 的聚合方式（先逐样本求差再平均，还是先求均值再相减）保留为待确认的口径问题，不应在未核实前断言某一选择正确。",
  "stage_labels": [],
  "summary": "最终脚本 S0064 已运行并生成 output1.csv（562 行）和 output2.csv（303 行），但 output1.csv 的 recommended_crop 列被赋值为最高产作物 Item，导致 562 行全部显示 recommended_crop=produced_crop=Potatoes，而同一脚本算出的全球推荐作物是 Teff；这与任务要求的 recommended_crop 字段不符，是已确认的交付内容错误。FINAL0001 只说“The solution ran successfully. Now let me verify the output files and their content.”，没有实际读回或核对文件名、列/格式、行和值，因此任务要求的核验未在最终回复中完成。农药阈值在 pesticides.csv 的 Value（p75=7869.0）与 yield_df 的 pesticides_tonnes（p75=48687.88）之间切换，使错配数从 143 变为 562；任务文本“all pesticide values”未明确指定数据源，该口径仍待确认。temp_range 采用 filtered_cr 上 mean(T2M_MAX-Su)-mean(T2M_MIN-W)，与“average seasonal temperature range”的另一种逐样本求差再平均口径不同，也未被任务文本唯一确定。S0017–S0031 反复出现 KeyError: 'Area'，原因是推荐数据没有 Area 列；该错误在 S0032 后已修正，未进入最终脚本。ARIMA 在 S0062 因“No supported index is available”全部失败并输出 0.0，S0063 改用 DatetimeIndex 后 S0064 恢复，仍有 ConvergenceWarning；这是已恢复的建模问题，未证明为最终错误。未使用官方评估、标准答案或运行后快照；output1/output2 的完整内容未全部读回，因此不能断言其余数值均正确。"
}