{
  "root_cause_chain": [],
  "critical_decision_points": [
    {
      "step_id": "S0014",
      "decision": "在 S0014 的筛选代码中把 MCC 条件写成 `if 5812 not in entry.get('merchant_category_code', []): results.append(entry)`，即把不含 5812 的规则纳入，得到 21 条规则并算出平均 0.127286。",
      "reasoning": "这是真实的局部逻辑错误（条件取反），但 S0015 的助手文本（E00053）已识别“previous run was missing mcc filtering”，S0015/S0016 用 `5812 in ...` 重新筛选得到 3 条规则、平均 0.064，最终 answer.txt 为 0.064，因此该错误已被修正，未进入最终交付。",
      "should_have": "使用 `if 5812 in entry.get('merchant_category_code', []): results.append(entry)`，只纳入 MCC 列表包含 5812 的规则。",
      "evidence_ids": ["E00046", "E00047", "E00050", "E00051", "E00053", "E00054", "E00055"]
    },
    {
      "step_id": "S0017",
      "decision": "最终脚本（S0017）用 `'H' in entry.get('account_type', [])` 和 `5812 in entry.get('merchant_category_code', [])` 做显式成员判断，未实现 manual 所述“字段为 null 时适用该字段所有取值”的通配语义；数据中 account_type 存在空列表（ID=1）。",
      "reasoning": "manual（E00039）明确 null 表示适用所有取值；若存在 card_scheme 为 GlobalCard 且 account_type 为空列表/null 或 merchant_category_code 为空列表/null 的规则，这些规则也应适用于 H 和 5812，但当前筛选会排除它们。已检证据未显示这类 GlobalCard 规则是否存在（代码对 null account_type/mcc 会抛 TypeError，而实际未报错，说明 GlobalCard 无 null account_type/mcc；空列表与 null card_scheme 仍未核实），因此无法判定是否漏算规则，也无法判定 0.064 是否正确。",
      "should_have": "在筛选前先核查 fees.json 中 GlobalCard 规则是否存在空列表/null 的 account_type、merchant_category_code 或 null card_scheme，并按 manual 的通配语义决定是否纳入；若纳入则重新计算平均并更新 answer.txt。",
      "evidence_ids": ["E00015", "E00029", "E00039", "E00058", "E00063", "E00066"]
    }
  ],
  "correct_strategy": "保留已修正的 3 条规则筛选与费用公式；进一步核查 fees.json 中是否存在 card_scheme 为 GlobalCard 且 account_type 为空列表/null 或 merchant_category_code 为空列表/null 的规则（以及 card_scheme 为 null 的规则），按 manual 的 null=适用所有取值语义判断是否应纳入平均；若纳入，重新计算平均费用并更新 answer.txt。现有证据不足以断言 0.064 一定错误或一定正确。",
  "stage_labels": [],
  "summary": "已确认：最终 answer.txt 内容为 0.064，来自 3 条显式匹配规则（ID=204/612/921）的费用 0.071、0.089、0.032 的算术平均；费用公式 fixed_amount + rate * transaction_value / 10000 与 manual 一致；S0014 曾因把 MCC 条件写成 `5812 not in ...` 而得到 21 条规则、平均 0.127286，该错误在 S0015/S0016 被识别并修正，未进入最终答案。未确认的疑点：筛选要求 account_type 显式含 H、merchant_category_code 显式含 5812，未实现 manual 所述 null=适用所有取值的通配语义；数据中 account_type 存在空列表（ID=1），空列表是否等同“适用所有”未由已检证据确定，且已检证据未显示 GlobalCard 是否存在空/null account_type 或 mcc 的规则，因此无法判定是否漏算规则、也无法判定 0.064 是否正确。另：answer.txt 写为 0.064 而非 6 位小数 0.064000，属格式细节。未使用官方评估、参考答案或运行后快照。"
}